{
  "id": "kitana",
  "type": "character",
  "name": "Kitana",
  "timelineIds": ["original"],
  "realmIds": ["edenia"],
  "description": "Princess of Edenia, raised under Shao Kahn after his conquest of her realm and later central to Edenia's liberation in the original continuity.",
  "tags": ["edenian", "princess", "ancient-history"]
}
