{
  "id": "sindel",
  "type": "character",
  "name": "Sindel",
  "timelineIds": ["original", "reboot", "new-era"],
  "realmIds": ["edenia", "outworld"],
  "description": "A royal figure whose title, rule, marriage history, and relationship to Shao Kahn differ materially across the Original, Reboot, and New Era continuities.",
  "tags": ["edenian", "queen", "empress", "claim-history"]
}
